"tweet_id","country","org_name","day","user_id","user_name","text","text_en","lobbying","lobbying_type","non_lobbying_type"
"1546218275842957312","ire","Association of Irish Local Government","2022-07-10 19:42:18","1245659485361680388","AILGIRE","#AILG President Cllr. Crossan joined   @PresidentIRL, Taoiseach @MichealMartinTD &amp; Cathaoirleach and Mayors across the country in @NMIreland earlier today in remembering Irishmen &amp; Irishwomen who died in past wars or on service with the United Nations #NationalDayofCommemoration https://t.co/hXKcNNjZmA","#AILG President Cllr. Crossan joined   @PresidentIRL, Taoiseach @MichealMartinTD &amp; Cathaoirleach and Mayors across the country in @NMIreland earlier today in remembering Irishmen &amp; Irishwomen who died in past wars or on service with the United Nations #NationalDayofCommemoration https://t.co/hXKcNNjZmA","0",NA,"other"
"864208772935409665","us","The MassMutual Financial Group Contributions Program","2017-05-15 20:00:02","25996721","massmutual","Jackie Lam of @Cheapsters shares lessons from her parents when it comes to saving for retirement. @SocietyGrownups https://t.co/wUQDdsPu2H https://t.co/gHiMx3gcR5","Jackie Lam of @Cheapsters shares lessons from her parents when it comes to saving for retirement. @SocietyGrownups https://t.co/wUQDdsPu2H https://t.co/gHiMx3gcR5","0",NA,"community"
"1541836086682570752","ire","Smashing Times Theatre and Film Company","2022-06-28 17:29:03","342653473","Smashing_Times","Freda was delighted to speak on a panel facilitated by #TeatrGrodski on the importance of accreditation for arts facilitation
(the panel before her were a little less animated! )

Freda was in Poland for a meeting of the RESTORE project: https://t.co/9OtnPZ00oW
#arts https://t.co/UTXNYs7fYJ","Freda was delighted to speak on a panel facilitated by #TeatrGrodski on the importance of accreditation for arts facilitation
(the panel before her were a little less animated! )

Freda was in Poland for a meeting of the RESTORE project: https://t.co/9OtnPZ00oW
#arts https://t.co/UTXNYs7fYJ","1","other",NA
"1298199621441855489","ire","The ONE Campaign","2020-08-25 10:04:43","16348549","ONECampaign","Today were taking you back to when @kumailn donated his channels to @larrybrilliant to talk about #COVID19 - wow, we learned a lot! Were grateful to all the celebs and experts who united for our #PassTheMic series. Sign our petition https://t.co/Yn5EE8Ul46 #ONEWorld https://t.co/P97UgW5Y9W","Today were taking you back to when @kumailn donated his channels to @larrybrilliant to talk about #COVID19 - wow, we learned a lot! Were grateful to all the celebs and experts who united for our #PassTheMic series. Sign our petition https://t.co/Yn5EE8Ul46 #ONEWorld https://t.co/P97UgW5Y9W","1","indirect",NA
"1418502930613870593","ire","The Music Network Ltd","2021-07-23 09:27:07","102674048","MusNetIrl","We are so delighted that https://t.co/rJEjhUnUiT by @pixel_design_ has been included in the prestigious @100archive for 2020!  We[a]re one of 100 notable communication design projects, selected each year following an open call:  
https://t.co/UmXGrSjZgS https://t.co/wg2aiXBNgH","We are so delighted that https://t.co/rJEjhUnUiT by @pixel_design_ has been included in the prestigious @100archive for 2020!  We[a]re one of 100 notable communication design projects, selected each year following an open call:  
https://t.co/UmXGrSjZgS https://t.co/wg2aiXBNgH","0",NA,"organizational"
"1353664022961401856","den","Akzo Nobel A/S","2021-01-25 11:20:27","13065032","AkzoNobel","Announced today at the World Economic Forum, AkzoNobel is the most sustainable in our industry according to the @corporateknights index, and ranked #28 overall. Join the live event here: https://t.co/Kn3f1HfFgD #PeoplePlanetPaint #DavosAgenda @wef https://t.co/VZK9cCSR6F","Announced today at the World Economic Forum, AkzoNobel is the most sustainable in our industry according to the @corporateknights index, and ranked #28 overall. Join the live event here: https://t.co/Kn3f1HfFgD #PeoplePlanetPaint #DavosAgenda @wef https://t.co/VZK9cCSR6F","0",NA,"organizational"
"1538552293393584132","den","LEGO A/S","2022-06-19 16:00:26","295325513","LEGO_Group","Sometimes a gift can mean more than you will ever know  

#LEGOStarWars #StarWars https://t.co/exExep3lBT","Sometimes a gift can mean more than you will ever know  

#LEGOStarWars #StarWars https://t.co/exExep3lBT","0",NA,"marketing"
"1222922120595955714","den","Den Danske Europabevægelse","2020-01-30 16:38:49","1498419390","EuropaBev","[a]Skal gammelt venskab glemmes?[a] - synger Europa-Parlamentet i anledning af Brexit. [a]Nej[a] - siger vi. Enig? #eudk #dkpol https://t.co/Ugzi4CzYWd","How old friendship is forgotten?[a] - the European Parliament sings on the occasion of Brexit. We say no, we say no. agree? #eudk #dkpol https://t.co/Ugzi4CzYWd","1","direct",NA
"1365384787331006465","ire","Connacht Rugby","2021-02-26 19:34:35","76679385","connachtrugby","FACT| Tonights victory means we have set a club record for consecutive league away wins with five Ws on the spin. 

#BENvCON #GuinnessPRO14 https://t.co/vCFMDVZ2tt","FACT| Tonights victory means we have set a club record for consecutive league away wins with five Ws on the spin. 

#BENvCON #GuinnessPRO14 https://t.co/vCFMDVZ2tt","0",NA,"organizational"
"972111682762956802","den","TV 2/Østjylland S/I","2018-03-09 14:07:40","2797597643","TV2OSTJYLLAND","Region Midtjylland skal spare 295 millioner kroner i 2019.

https://t.co/DGQGiHZoOH https://t.co/FVIf3jxNOx","Region Midtjylland skal spare 295 millioner kroner i 2019.

https://t.co/DGQGiHZoOH https://t.co/FVIf3jxNOx","0",NA,"other"
"425916225026158592","den","Wintershall Dea","2014-01-22 09:01:56","351468642","Dwintershalldea","Rainer Seele: [a]Russland und Norwegen sind Energie-Riesen. Wintershall setzt auf beide.[a] #hbenergie http://t.co/zZyIb2LcZk","Rainer Soul: Russia and Norway are energy giants. The Winter Hall is on both.[a] #hbenergie http://t.co/zZyIb2LcZk","0",NA,"organizational"
"1291487210278019073","den","OCEANA","2020-08-06 21:32:00","29221344","oceana","Clear the way! https://t.co/Xj8BrJyDV8","Clear the way! https://t.co/Xj8BrJyDV8","0",NA,"other"
"1396769419913748481","ire","ATD Fourth World Ireland CLG","2021-05-24 10:05:55","2510820704","ATDIreland","[a]70 per cent of the calls @SVP_Ireland receive are from households with children. As a country we need to say as a country that no level of child poverty is acceptable[a]. @triciakeilthy #EndPoverty 
#ChildGuarantee https://t.co/1iexHwwjxE","[a]70 per cent of the calls @SVP_Ireland receive are from households with children. As a country we need to say as a country that no level of child poverty is acceptable[a]. @triciakeilthy #EndPoverty 
#ChildGuarantee https://t.co/1iexHwwjxE","1","other",NA
"1483341923150700544","den","Københavns Professionshøjskole S/I","2022-01-18 07:34:08","965617722049654784","kbhprof","Der er en grund til, at rektor @SthePol siger, at @kbhprof fr tilskud fra politikerne med den lille hnd og fr fjernet ressourcer med den store hnd i forbindelse med regeringens udflytningsaftale  #uddpol #dkpol #kbhprof https://t.co/k4CJWBAiTi https://t.co/tOilcOpj6I","There is a reason that rector @SthePol says that @kbhprof fr grants from the politicians with the small hnd and fr removed resources with the big hnd in connection with the government’s exchange agreement #uddpol #dkpol #kbhprof https://t.co/k4CJWBAiTi https://t.co/tOilcOpj6I","1","direct",NA
"1123296927494430721","us","The Witte Museum","2019-04-30 18:43:52","37926532","WitteMuseum","Watershed Simulation Table - The mountains and valleys you make represent parts of a watershed. 
#WitteMuseum #AmazingWitteEveryday #tuesdaythoughts #rainydays #rain #water #watershed #landstewardship #healthywatershed #onlyatthewitte https://t.co/gXI7UgSb5Z","Watershed Simulation Table - The mountains and valleys you make represent parts of a watershed. 
#WitteMuseum #AmazingWitteEveryday #tuesdaythoughts #rainydays #rain #water #watershed #landstewardship #healthywatershed #onlyatthewitte https://t.co/gXI7UgSb5Z","0",NA,"other"
"1523994943844462593","den","Den Katolske Kirke i Danmark","2022-05-10 11:54:43","904961712226533376","katolskdk","bent brev fra katolske journalister til paven https://t.co/6ryJlQNpxx https://t.co/gaYZifuyWn","bent brev fra katolske journalister til paven https://t.co/6ryJlQNpxx https://t.co/gaYZifuyWn","1","indirect",NA
"1199600388216885249","den","Komiteen for Sundhedsoplysning","2019-11-27 08:06:34","1105441481056227329","KomSundDK","Komiteen, @SSTSundhed og Styrelsen for Undervisning og Kvalitet afholder flles konference om #mentalsundhed for unge i dag - vi deler vrktjer, erfaringer og forskning, der gr markant forskel. #lrattackle, #empowerment https://t.co/Bmzoc5ji10","The committee, @SSTHealth and the Board of Education and Quality hold a full conference on #Mental Health for Youth today - we share outcomes, experiences and research that make a significant difference. #lrattackle, #empowerment https://t.co/Bmzoc5ji10","1","direct",NA
"1458570458782175233","us","Health Alliance Plan","2021-11-10 23:01:10","182920486","hapmichigan","Big news! @usnews ranked us as the Best Insurance Company for #Medicare Advantage Plans based on our #HAP Medicare Advantage plans. We[a]re 1 of only 3 insurers in #Michigan to earn the prestigious recognition. Learn more: https://t.co/GVFqEQUUFl. #MadeInMichigan https://t.co/vznRAY9gSy","Big news! @usnews ranked us as the Best Insurance Company for #Medicare Advantage Plans based on our #HAP Medicare Advantage plans. We[a]re 1 of only 3 insurers in #Michigan to earn the prestigious recognition. Learn more: https://t.co/GVFqEQUUFl. #MadeInMichigan https://t.co/vznRAY9gSy","0",NA,"organizational"
"1357272992477294594","den","Amnesty International","2021-02-04 10:21:12","18213483","amnesty","There are 2.3 million people in need of lifesaving assistance in #Ethiopia[a]s Tigray region. Humanitarian aid is available, but access has been extremely limited. Send an email to pressure @AbiyAhmedAli to #AllowAccessToTigray. 

Take action now: https://t.co/Jq144j3ed1  https://t.co/mD7wGokkHN","There are 2.3 million people in need of lifesaving assistance in #Ethiopia[a]s Tigray region. Humanitarian aid is available, but access has been extremely limited. Send an email to pressure @AbiyAhmedAli to #AllowAccessToTigray. 

Take action now: https://t.co/Jq144j3ed1  https://t.co/mD7wGokkHN","1","indirect",NA
"936515448107159552","den","Netcompany A/S","2017-12-01 08:40:57","3107666464","Netcompany_DK","RT @EOYdk: @Netcompany_DK vinder Growth DK ved EY Entrepreneur Of The Year 2017 #EOYdk https://t.co/59Sy0bPkUm","RT @EOYdk: @Netcompany_DK vinder Growth DK ved EY Entrepreneur Of The Year 2017 #EOYdk https://t.co/59Sy0bPkUm","0",NA,"organizational"
"1320606192083869696","den","Det Økologiske Råd","2020-10-26 06:00:26","788915102","gronomstilling","Alt for mange danskere dr af luftforurening. Faktisk overholder DK ikke EU-lovgivningen og risikerer en retssag. Alligevel mangler der politisk handling. Det er ikke i orden. Vr med til at krve #renluft til os alle  skriv under og vis #dkpol vejen her:
https://t.co/dSNhW1VC9Q https://t.co/iM2JQCoqoJ","Too many people are suffering from air pollution. In fact, DK does not comply with EU law and risks a trial. But there is a lack of political action. It is not okay. Write the #Renluft to us all sign and show the #dkpol path here:
WEB WEB WEB WEB WEB WEB WEB WEB WEB WEB WEB WEB WEB WEB","1","indirect",NA
"1465244908516749315","us","Madison Group, LLC","2021-11-29 09:03:03","804605049859145728","TRTWorldNow","Belarusian Defence Minister Viktor Khrenin says NATO is building up offensive capabilities of armed forces near Belarus[a] borders  Belta https://t.co/pO4s0iGGKM","Belarusian Defence Minister Viktor Khrenin says NATO is building up offensive capabilities of armed forces near Belarus[a] borders  Belta https://t.co/pO4s0iGGKM","1","other",NA
"1268658586823122950","den","The European Cockpit Association","2020-06-04 21:39:12","835738927","eu_cockpit","The European Commission still has the opportunity to change the course of this disaster. Otherwise, we will soon have an aviation industry trying to take off, but without qualified and experienced pilots. https://t.co/shf7DumKnT","The European Commission still has the opportunity to change the course of this disaster. Otherwise, we will soon have an aviation industry trying to take off, but without qualified and experienced pilots. https://t.co/shf7DumKnT","1","direct",NA
"1508836901750513675","den","Brancheforeningen for Lægemiddelvirksomheder i Danmark (LIF)","2022-03-29 16:02:04","1182523638","LifDK","To nye ansigter i Lifs bestyrelse

Catherine Williams @MSDDanmark  og Thorsten Thormann @LEOHealthySkin er nye medlemmer af Lifs bestyrelse. Valget bd i vrigt p genvalg til @AThelborg og @torevonwurden 

Ls mere her  https://t.co/0j8mXRN4Mz https://t.co/qOwsjGM7Wi","Two new faces in the Board of Directors

Catherine Williams @MSDDanmark and Thorsten Thormann @LEOHealthySkin are new members of Lifs Board. Election bd in rough p re-election to @AThelborg and @torevonwurden 

Read more here https://t.co/0j8mXRN4Mz https://t.co/qOwsjGM7Wi","0",NA,"organizational"
"1469361850026504193","den","Studerende for et Frit Tibet","2021-12-10 17:42:19","20443232","SFTHQ","I dont really call it activism, @chemilhamoooo tells Teen Vogue. Its a responsibility and a duty I have. Every Tibetan born after 1959 is born an activist  I dont think we have the choice. https://t.co/nFqyuxTC5q","I dont really call it activism, @chemilhamoooo tells Teen Vogue. Its a responsibility and a duty I have. Every Tibetan born after 1959 is born an activist  I dont think we have the choice. https://t.co/nFqyuxTC5q","1","indirect",NA
"913107339603038209","us","Egypt, Embassy of the Arab Republic of","2017-09-27 18:25:29","2153723652","EgyptEmbassyUSA","Many thanks to @SenatorCardin, @RepJoeKennedy, @RepDWStweets, @RepChrisStewart and @RepHankJohnson for their attendance and remarks https://t.co/uVDYgY3sTU","Many thanks to @SenatorCardin, @RepJoeKennedy, @RepDWStweets, @RepChrisStewart and @RepHankJohnson for their attendance and remarks https://t.co/uVDYgY3sTU","1","direct",NA
"1314629981872574466","us","Michigan Municipal League","2020-10-09 18:13:06","43125384","MMLeague","Urgent! Ask your State Rep to support new Open Meetings Act bill that would enable public bodies to conduct remote meetings under specific circumstances. @DPGilmartin @aminghine @rigterink1 https://t.co/zzHSjWpkkw https://t.co/xj4vSyuMGw","Urgent! Ask your State Rep to support new Open Meetings Act bill that would enable public bodies to conduct remote meetings under specific circumstances. @DPGilmartin @aminghine @rigterink1 https://t.co/zzHSjWpkkw https://t.co/xj4vSyuMGw","1","indirect",NA
"827208517824217089","ire","The Rutland Centre Ltd","2017-02-02 17:34:14","3294014542","RutlandCentre","The panelists are looking good and ready to share their experiences and wealth of knowledge - Tara, Niall, Austin and Barry https://t.co/hZSSHpUGJv","The panelists are looking good and ready to share their experiences and wealth of knowledge - Tara, Niall, Austin and Barry https://t.co/hZSSHpUGJv","0",NA,"community"
"1471148591037173762","ire","Engineers Ireland","2021-12-15 16:02:11","26988551","EngineerIreland","Day 3 of our reflective #12DaysOfChristmas is #sustainability. Our resources on this topic incl a submission to Ireland[a]s Climate Action Plan, an Issues Paper on protecting biodiversity &amp; our Sustainability Framework. Read more: https://t.co/0vAQdNHaDy #engineeringsustainability https://t.co/s7T5fZLDYV","Day 3 of our reflective #12DaysOfChristmas is #sustainability. Our resources on this topic incl a submission to Ireland[a]s Climate Action Plan, an Issues Paper on protecting biodiversity &amp; our Sustainability Framework. Read more: https://t.co/0vAQdNHaDy #engineeringsustainability https://t.co/s7T5fZLDYV","1","other",NA
"1496508162777698306","us","Forbes, Inc.","2022-02-23 15:32:04","91478624","Forbes","Big changes are coming to Call of Duty https://t.co/F4vyTc6d0V https://t.co/kNoxH8xeO6","Big changes are coming to Call of Duty https://t.co/F4vyTc6d0V https://t.co/kNoxH8xeO6","0",NA,"marketing"
"540142587362172928","den","SimCorp","2014-12-03 13:56:42","132636700","SimCorp","Survey reveals how asset managers evolve their operating models to deal with key market trends http://t.co/KvGITGlFoq http://t.co/QiRfuvSdxO","Survey reveals how asset managers evolve their operating models to deal with key market trends http://t.co/KvGITGlFoq http://t.co/QiRfuvSdxO","0",NA,"other"
"1382861297130295298","us","Mexico, Secretaria de Economia","2021-04-16 01:00:00","1067218403914436608","GobiernoMX","Las nias y los nios no deben utilizarse en asuntos que afectan sus derechos humanos. 

Para garantizar la seguridad, instituciones como la @GN_MEXICO aumentan su presencia en todo el pas. https://t.co/997ty5g8vc","Nines and nines should not be used in matters affecting their human rights. 

To ensure security, institutions such as @GN_MEXICO increase their presence throughout. HTTPS://t.co/997ty5g8vc","1","other",NA
"1271538150163255303","den","Forskningsbibliotekernes Chefkollegium","2020-06-12 20:21:33","17840530","astronerd","Whats up with #betelgeuse - l bet the same phenomenon was behind the 5-month of dimming +1 yr ago - but what is it? The star is rotating slower than this, but convection is about the right timescale ... https://t.co/5IqoZSFtq9","Whats up with #betelgeuse - l bet the same phenomenon was behind the 5-month of dimming +1 yr ago - but what is it? The star is rotating slower than this, but convection is about the right timescale ... https://t.co/5IqoZSFtq9","0",NA,"other"
"382903307930308608","us","Roetzel & Andress L.P.A.","2013-09-25 16:23:57","23805262","Roetzel_Andress","Lisa H. Lipman joins the Naples office:    http://t.co/egL1YgrhWz http://t.co/ywy5uPGPUk","Lisa H. Lipman joins the Naples office:    http://t.co/egL1YgrhWz http://t.co/ywy5uPGPUk","0",NA,"organizational"
"1506720062031421448","den","United Nations Population Fund (UNFPA)","2022-03-23 19:50:30","194643654","UNFPA","During her visit to #Moldova, @UNFPA Executive Director Dr. Natalia Kanem met women who fled war in #Ukraine.

Many dont know where to go or what to do.

Let @Atayeshe give you an exclusive look at how @UNFPAMoldova is standing #WithRefugees: https://t.co/RvrIKXUTnz https://t.co/WmFdeQNIYu","During her visit to #Moldova, @UNFPA Executive Director Dr. Natalia Kanem met women who fled war in #Ukraine.

Many dont know where to go or what to do.

Let @Atayeshe give you an exclusive look at how @UNFPAMoldova is standing #WithRefugees: https://t.co/RvrIKXUTnz https://t.co/WmFdeQNIYu","1","direct",NA
"1517449333314043905","den","Adform A/S","2022-04-22 10:24:48","294061106","adform","Adform is honored to be among the winners of The Drum Awards for Digital Advertising! Were especially proud to be recognized for our pioneering identity solution, Adform ID Fusion, in the category of Best Response to Change. https://t.co/5WGCU05V3M #drum #idfusion #firstpartyIDs https://t.co/WYYR6xFUiP","Adform is honored to be among the winners of The Drum Awards for Digital Advertising! Were especially proud to be recognized for our pioneering identity solution, Adform ID Fusion, in the category of Best Response to Change. https://t.co/5WGCU05V3M #drum #idfusion #firstpartyIDs https://t.co/WYYR6xFUiP","0",NA,"organizational"
"1375983477753966593","den","WWF Verdensnaturfonden","2021-03-28 01:30:00","13201312","WWF","#Mexico &amp; #Nicaragua, it[a]s your turn to switch off your lights! This #EarthHour, let[a]s come together virtually and shine a spotlight on our planet  Join millions of people switching off symbolically and sharing the Virtual Spotlight video pinned to the top of our page! https://t.co/tn5zKjJICc","#Mexico &amp; #Nicaragua, it[a]s your turn to switch off your lights! This #EarthHour, let[a]s come together virtually and shine a spotlight on our planet  Join millions of people switching off symbolically and sharing the Virtual Spotlight video pinned to the top of our page! https://t.co/tn5zKjJICc","1","indirect",NA
"1333795492371828736","den","OCEANA","2020-12-01 15:30:00","29221344","oceana","Ocean plastic is a major threat to endangered species.

 Plastic production is expected to quadruple in the coming decades,[a] Oceana[a]s @DCChristy to @Forbes: https://t.co/sgUULydpsh @PressOceana #BreakFreeFromPlastic #PlasticFreeSeas https://t.co/UaiYkrheAe","Ocean plastic is a major threat to endangered species.

 Plastic production is expected to quadruple in the coming decades,[a] Oceana[a]s @DCChristy to @Forbes: https://t.co/sgUULydpsh @PressOceana #BreakFreeFromPlastic #PlasticFreeSeas https://t.co/UaiYkrheAe","1","other",NA
"1197198744552427521","den","Intertek","2019-11-20 17:03:18","177201816","Intertek","#Petsafety is a cause close to the heart; our Product Assurance team has built fixtures and tools to mimic a #dog[a]s chewing and tearing actions, so they could test products for fatigue and failure. Read our blog post to learn more: https://t.co/ztMxmNWMag https://t.co/rAYZ1cj6zp","#Petsafety is a cause close to the heart; our Product Assurance team has built fixtures and tools to mimic a #dog[a]s chewing and tearing actions, so they could test products for fatigue and failure. Read our blog post to learn more: https://t.co/ztMxmNWMag https://t.co/rAYZ1cj6zp","1","other",NA
"1032240120001429504","ire","AerCap Holdings N.V.","2018-08-22 12:16:37","402037391","AerCapNV","We delivered our first #787-9 to @ChinaSouthernEU @CSAIRGlobal. This is the 78th #787 delivery for #AerCap. https://t.co/nuS53UvnPg","We delivered our first #787-9 to @ChinaSouthernEU @CSAIRGlobal. This is the 78th #787 delivery for #AerCap. https://t.co/nuS53UvnPg","0",NA,"organizational"
"1039862718331797504","us","Americans United for Life Action","2018-09-12 13:06:06","18583823","AUL","It is of utmost importance to me personally to safeguard innocent human life from conception until natural death. - Kansas Secretary of State Kris Kobach @KrisKobach1787 https://t.co/qlxnuY3IHK","It is of utmost importance to me personally to safeguard innocent human life from conception until natural death. - Kansas Secretary of State Kris Kobach @KrisKobach1787 https://t.co/qlxnuY3IHK","1","direct",NA
"897050206914609152","den","Fagforeningen Danmark","2017-08-14 11:00:10","2160647720","LederneDK","Store bunker p bordet: 68 pct. af lederne arbejder mere end normalt lige efter ferien. #dkledelse @BirgitteAlstrom  https://t.co/iUxZj91hlZ https://t.co/HAOouCtb6r","Big bunker on the table: 68 pct. They work more than usual after the vacation. #dleaning @BirgitteAlstrom https://t.co/iUxZj91hlZ https://t.co/HAOouCtb6r","0",NA,"other"
"1323630155470983174","us","Invest Northern Ireland","2020-11-03 14:16:35","64692506","InvestNI","We are supporting Enniskillen based SME #DrumcanonEngineering to build its brand with our marketing support and create three new jobs to help it grow its business. #engineering #ExportingisGREAT https://t.co/1LQNpTjykp","We are supporting Enniskillen based SME #DrumcanonEngineering to build its brand with our marketing support and create three new jobs to help it grow its business. #engineering #ExportingisGREAT https://t.co/1LQNpTjykp","0",NA,"marketing"
"1471540870470062096","us","Health Policy Strategies","2021-12-16 18:00:58","48715988","BostonChildrens","Leslie Kean, MD, PhD, says the @US_FDA approval of abatacept for #GVHD prevention will allow more patients to safely undergo #stemcelltransplants, particularly those of diverse ethnicities who have more difficulty finding matched donors. #healthequity https://t.co/YhzcxEEGGT","Leslie Kean, MD, PhD, says the @US_FDA approval of abatacept for #GVHD prevention will allow more patients to safely undergo #stemcelltransplants, particularly those of diverse ethnicities who have more difficulty finding matched donors. #healthequity https://t.co/YhzcxEEGGT","1","other",NA
"1318434318604095488","den","SBS-Net A/S","2020-10-20 06:10:11","743219125321752576","SBSOnDemand","In Copenhagen, the brutal murder of a young girl launches an extended police investigation. Over 20 days, multiple suspects are sought out as violence and political pressures cast their shadows over the hunt for the killer.

The Killing | S1 now streaming: https://t.co/8NQhY5nqG7 https://t.co/EsGSz38VSb","In Copenhagen, the brutal murder of a young girl launches an extended police investigation. Over 20 days, multiple suspects are sought out as violence and political pressures cast their shadows over the hunt for the killer.

The Killing | S1 now streaming: https://t.co/8NQhY5nqG7 https://t.co/EsGSz38VSb","0",NA,"marketing"
"1100684220886859776","den","AIDS-Fondet","2019-02-27 09:09:02","1667608520","AIDSFondet","En tredjedel af de personer, der dr med aids dr som flge af tuberkulose. 

Derfor er vi med til dagens TB-briefing p Christiansborg, som indledes af @pederhvelplund. 

#dkpol #sundpol https://t.co/hnFgGFuyaM","One-third of the people who take AIDS dr as a flame of tuberculosis. 

This is why we are part of today’s TB briefing p Christiansborg, which began by @pederhvelplund. 

#dkpol #sundpol https://t.co/hnFgGFuyaM","1","direct",NA
