"tweet_id","country","org_name","day","user_id","user_name","text","text_en","lobbying","lobbying_type","non_lobbying_type"
"1480927326322008073","den","Orange Business Services","2022-01-11 15:39:23","19398874","orangebusiness","#NEWS 
[a]Orange Business Services appoints Nassima Auvray as Strategy and Marketing Director for Trusted Cloud Solutions[a]
Discover our new Director of Strategy and Marketing for Trusted #Cloud Solutions 
https://t.co/AUTVO4cz5d https://t.co/YGfjsSb4KQ","#NEWS 
[a]Orange Business Services appoints Nassima Auvray as Strategy and Marketing Director for Trusted Cloud Solutions[a]
Discover our new Director of Strategy and Marketing for Trusted #Cloud Solutions 
https://t.co/AUTVO4cz5d https://t.co/YGfjsSb4KQ","0",NA,"organizational"
"1530520607607111692","ire","Cricket Ireland","2022-05-28 12:05:23","221580536","cricketireland","An excellent bowling spell of 3-30 from 3 overs by @CL_LLightning Gavin Hoey 

#IP20Festival | #NWWvLL  

@gtew00 https://t.co/IQH0th69KN","An excellent bowling spell of 3-30 from 3 overs by @CL_LLightning Gavin Hoey 

#IP20Festival | #NWWvLL  

@gtew00 https://t.co/IQH0th69KN","0",NA,"community"
"1448936860810612747","ire","Community Creations Limited t/a SpunOut.ie","2021-10-15 09:00:42","19594963","SpunOut","Language matters. Using phrases like [a]that[a]s mad[a], [a]that[a]s mental[a] or [a]that[a]s crazy[a] can be easy to do, but can also be hurtful and stigmatising to people who experience mental health issues. https://t.co/Oa6RzU96hQ https://t.co/X6GZy83a33","Language matters. Using phrases like [a]that[a]s mad[a], [a]that[a]s mental[a] or [a]that[a]s crazy[a] can be easy to do, but can also be hurtful and stigmatising to people who experience mental health issues. https://t.co/Oa6RzU96hQ https://t.co/X6GZy83a33","0",NA,"other"
"1331895802386640896","den","BØRNEfonden international","2020-11-26 09:41:19","59560250","PlanGlobal","Our global research shows that 58% of girls surveyed have experienced online harassment. As #COVID19 moves our lives online, girls are more at risk than ever.  Stand with girls so they are #FreeToBeOnline #16Days https://t.co/hMqutcstsR","Our global research shows that 58% of girls surveyed have experienced online harassment. As #COVID19 moves our lives online, girls are more at risk than ever.  Stand with girls so they are #FreeToBeOnline #16Days https://t.co/hMqutcstsR","1","indirect",NA
"1462888846497099782","den","Teach First Danmark","2021-11-22 21:00:54","1173003534","teachfirstdk","Ny undersgelse har talt med kolleger, elever og skoleledere p nogle af de 73 skoler, som har ansat lrere via Teach First Danmark. Den viser, at det er fagligt dygtige lrere, og at 100% af skolerne er tilfredse med lrerne  #uddpol

Ls et resum: https://t.co/pTkra7wmEr https://t.co/QDQaf8gVQv","New research has talked with colleagues, students and school leaders in some of the 73 schools that have employed teachers via Teach First Denmark. It shows that there are academically skilled teachers, and that 100% of schools are satisfied with the teachers #uddpol

Ls a summary: https://t.co/pTkra7wmEr https://t.co/QDQaf8gVQv","1","other",NA
"1284805365213941766","ire","The Institute of Directors in Ireland","2020-07-19 11:00:44","562917165","IoDIreland","Congratulations and best of luck to Professor @DaireKeogh CDir, who is both a Chartered Director and member of @IoDIreland, on formally taking office as President of @DCU this week.
https://t.co/0HKL4uJW6e https://t.co/7wPpzVIJP9","Congratulations and best of luck to Professor @DaireKeogh CDir, who is both a Chartered Director and member of @IoDIreland, on formally taking office as President of @DCU this week.
https://t.co/0HKL4uJW6e https://t.co/7wPpzVIJP9","0",NA,"organizational"
"1498605518906081283","ire","Irish Sports Matters Ltd t/a the Federation of Irish Sport","2022-03-01 10:26:13","380813850","iresport","Thank you @raelenecastle CEO of @SportNZ for sharing her insights on their Every Body Move campaign and the focus on youth participation and lots more at our 2022 Member CEO Forum this morning. https://t.co/VNb8S7J1jd","Thank you @raelenecastle CEO of @SportNZ for sharing her insights on their Every Body Move campaign and the focus on youth participation and lots more at our 2022 Member CEO Forum this morning. https://t.co/VNb8S7J1jd","1","other",NA
"1497924926594068485","us","Madison Group, LLC","2022-02-27 13:21:47","804605049859145728","TRTWorldNow","Slovak government approves further military aid to Ukraine worth $4,9 million (4.4 million)  media https://t.co/AdLNtO8hA7","Slovak government approves further military aid to Ukraine worth $4,9 million (4.4 million)  media https://t.co/AdLNtO8hA7","1","direct",NA
"1351246730877161485","us","StateScape","2021-01-18 19:15:00","726756558","StateScape","Which legislative sessions are in and which are out? StateScape keeps you up-to-date. https://t.co/e5TTKGP6H2 https://t.co/ihk030bVTY","Which legislative sessions are in and which are out? StateScape keeps you up-to-date. https://t.co/e5TTKGP6H2 https://t.co/ihk030bVTY","0",NA,"marketing"
"1240379356796633088","den","Aircraft Owners and Pilots Association (AOPA)","2020-03-18 20:47:38","16438430","AOPA","In response to the concerns of many members who face obstacles for remaining in compliance, AOPA is urging the FAA to exert a maximum amount of flexibility to help keep pilots and aircraft up and running during the COVID-19 crisis.#GAAdvocacy
Read more: https://t.co/bVZxZPuQk8 https://t.co/UFbzPV68nn","In response to the concerns of many members who face obstacles for remaining in compliance, AOPA is urging the FAA to exert a maximum amount of flexibility to help keep pilots and aircraft up and running during the COVID-19 crisis.#GAAdvocacy
Read more: https://t.co/bVZxZPuQk8 https://t.co/UFbzPV68nn","1","direct",NA
"1134402062362533889","den","Kvinderådet","2019-05-31 10:11:42","1456356457","Kvinderaadet","Stem p en kvinde, mand! I dag kl 15 p Axeltorv i Fredericia er vi at finde sammen med @LotteRod fra @radikale, @EvaKjerHansen fra @venstredk og @MF_K_Lorentzen  fra @SFpolitik  #StemPEnKvinde #FV19 https://t.co/edG3wjKvdn","A woman, a man! Today at 15 p Axeltorv in Fredericia we are to find together with @LotteRod from @radikale, @EvaKjerHansen from @venstredk and @MF_K_Lorentzen from @SFpolitik #StemPEnKvinde #FV19 https://t.co/edG3wjKvdn","1","indirect",NA
"1359622704324890635","us","Bernalillo, New Mexico, County of","2021-02-10 21:58:07","1223050310","BernCounty","Bernalillo County, in partnership with the Albuquerque Indian Center, accepted the certificate of occupancy on the Tiny Home Village project and has welcomed the first residents to the community located at 101 Texas St. SE, in the International District.
https://t.co/4wshP9aaWF https://t.co/6uO8xLPhGz","Bernalillo County, in partnership with the Albuquerque Indian Center, accepted the certificate of occupancy on the Tiny Home Village project and has welcomed the first residents to the community located at 101 Texas St. SE, in the International District.
https://t.co/4wshP9aaWF https://t.co/6uO8xLPhGz","1","other",NA
"1356336779394224137","den","Falcon.Io ApS","2021-02-01 20:21:02","395350496","FalconIO","2021 Digital Marketing Trends Virtual Summit: Day 2 

A Fork in the Advertising Road.
 Veena Ramakrishnan, @FalconIO
 Liat Karpel Gurwicz, @Wix
 
Save your seat  https://t.co/4Hklelw81s https://t.co/3T5q04TnoS","2021 Digital Marketing Trends Virtual Summit: Day 2 

A Fork in the Advertising Road.
 Veena Ramakrishnan, @FalconIO
 Liat Karpel Gurwicz, @Wix
 
Save your seat  https://t.co/4Hklelw81s https://t.co/3T5q04TnoS","0",NA,"marketing"
"839498701966094338","den","Nethosting","2017-03-08 15:31:02","63156153","NetHosting","#humpday #humpdayhumor #jokes https://t.co/gWHQcQMVIm","#humpday #humpdayhumor #jokes https://t.co/gWHQcQMVIm","0",NA,"other"
"1487108211647856653","us","American Association of Kidney Patients","2022-01-28 17:00:01","138036836","KidneyPatients","As part of our Center for Patient Engagement &amp; Advocacy, AAKPs Ambassador Program works to ensure that the voices of kidney patients and their families are heard. To meet our ambassadors or to become one yourself, visit our website! https://t.co/ugVUVCaf7N #AAKPForPatients https://t.co/dPAptuQxWE","As part of our Center for Patient Engagement &amp; Advocacy, AAKPs Ambassador Program works to ensure that the voices of kidney patients and their families are heard. To meet our ambassadors or to become one yourself, visit our website! https://t.co/ugVUVCaf7N #AAKPForPatients https://t.co/dPAptuQxWE","1","other",NA
"796858508394266624","us","Millennium Laboratories","2016-11-10 23:34:07","2915835681","MillenniumHlth","Great crowd at tonight[a]s @c_herren event at @stxinfo #DropThemOff https://t.co/MRXg1Dqvks","Great crowd at tonight[a]s @c_herren event at @stxinfo #DropThemOff https://t.co/MRXg1Dqvks","0",NA,"community"
"1444597101040582656","us","Roche Corporation","2021-10-03 09:36:02","20815041","Roche","This #BreastCancerAwarenessMonth were reminded of the unique and powerful stories of the #breastcancer community who have overcome great challenges to manage their disease and helped to reimagine what the colour pink means. Hear more  https://t.co/eKm7fNZvZu #MyShadeofPink https://t.co/DhZXeYbbn2","This #BreastCancerAwarenessMonth were reminded of the unique and powerful stories of the #breastcancer community who have overcome great challenges to manage their disease and helped to reimagine what the colour pink means. Hear more  https://t.co/eKm7fNZvZu #MyShadeofPink https://t.co/DhZXeYbbn2","1","other",NA
"1102826111505969153","den","Elitegroup Computer Systems (Ecscom) A/S","2019-03-05 07:00:09","804219695670829056","ECS_GlobalHQ","LIVA Q2- Even smaller than the soda can, but still amazing performance!

Learn more: https://t.co/jd9ELH0fwf 
#LIVAQ2 #MiniPC https://t.co/vbQeS4Lie3","LIVA Q2- Even smaller than the soda can, but still amazing performance!

Learn more: https://t.co/jd9ELH0fwf 
#LIVAQ2 #MiniPC https://t.co/vbQeS4Lie3","0",NA,"marketing"
"1371355514555207682","den","Danmarks Statistik","2021-03-15 07:00:07","2179660838","DSTdk","Lille fald i de prsterede timer i fjerde kvartal 2020. https://t.co/JZbRVpFTIT #dkpol #dkko https://t.co/Z1BxAbeXSu","Lille fald i de prsterede timer i fjerde kvartal 2020. https://t.co/JZbRVpFTIT #dkpol #dkko https://t.co/Z1BxAbeXSu","1","other",NA
"829732376985137152","ire","HINES REAL ESTATE IRELAND LIMITED","2017-02-09 16:43:09","599458769","Hines","Hines Secures CMS Hasche Sigle as Anchor Tenant at Dsseldorf[a]s Kasernenstrasse https://t.co/nDLrvmdyB0 https://t.co/LYw92oxIr5","Hines Secures CMS Hasche Sigle as Anchor Tenant at Dsseldorf[a]s Kasernenstrasse https://t.co/nDLrvmdyB0 https://t.co/LYw92oxIr5","0",NA,"organizational"
"1496957561924374531","den","Studerende for et Frit Tibet","2022-02-24 21:17:49","20443232","SFTHQ","March 10, 2022 will mark the 63rd anniversary of the Tibetan National Uprising Day. Make sure to save the date and join a protest near you!

Together, we will continue the fight for freedom and human rights in Tibet. 

#FreeTibet #humanrights #Freedom #Tibet #China #Protest https://t.co/NfCMDyApTC","March 10, 2022 will mark the 63rd anniversary of the Tibetan National Uprising Day. Make sure to save the date and join a protest near you!

Together, we will continue the fight for freedom and human rights in Tibet. 

#FreeTibet #humanrights #Freedom #Tibet #China #Protest https://t.co/NfCMDyApTC","1","indirect",NA
"1508808609894912002","den","Dansk Ungdoms Fællesråd","2022-03-29 14:09:39","3089078195","danskungdom","Deltagerbetaling kan vre en
forhindring for nogle, nr de skal
deltage i foreningslivet. Men ogs transport og udstyr kan vre svrt at finansiere. S undersg, om der er nogle puljer, der kan vre med til at dkke udgifterne  #vierduf https://t.co/aHXV6d6v7c","Payment can be a
Preventing for some, not to
Participate in the association. However, transportation and equipment can wrath to fund. S undersg, if there are some pills that can anger with to deck the expenses #vierduf https://t.co/aHXV6d6v7c","0",NA,"community"
"1012319853917757441","us","Center for Coastal Conservation Political Action Committee","2018-06-28 13:00:35","3141876639","sportfishpolicy","@USRepRickNolan Americas 11M saltwater anglers and the 440,000 ppl employed by our industry need the House to pass HR 200, which includes the #ModernFish Act. More access for anglers means a stronger natl economy, more jobs and additional money for conservation. #LetAmericaFish https://t.co/IhXFX0xBmC","@USRepRickNolan Americas 11M saltwater anglers and the 440,000 ppl employed by our industry need the House to pass HR 200, which includes the #ModernFish Act. More access for anglers means a stronger natl economy, more jobs and additional money for conservation. #LetAmericaFish https://t.co/IhXFX0xBmC","1","direct",NA
"1065988551676968960","den","THE ENGLISH-SPEAKING UNION OF DENMARK","2018-11-23 15:20:50","47638367","theESU","[a]We are powerful, we are smart and we do matter[a]
Watch here for more powerful words from Ellie&gt;&gt; https://t.co/LwoROWVqfQ
#GirlsBreakingBarriers #FridayFeels @UKHouseofLords https://t.co/3BzYikVboU","[a]We are powerful, we are smart and we do matter[a]
Watch here for more powerful words from Ellie&gt;&gt; https://t.co/LwoROWVqfQ
#GirlsBreakingBarriers #FridayFeels @UKHouseofLords https://t.co/3BzYikVboU","1","direct",NA
"1166079128086425600","den","Parkinsonforeningen","2019-08-26 20:05:03","107546283","ParkinsonDotOrg","Join us and @michaeljfoxorg on Tuesday, September 10, and effect real change for the #Parkinsons community by telling your lawmakers what matters to you. Learn more about our upcoming day of action here: https://t.co/PQ2627GQvX #Act4PD https://t.co/FKYlfX7GCG","Join us and @michaeljfoxorg on Tuesday, September 10, and effect real change for the #Parkinsons community by telling your lawmakers what matters to you. Learn more about our upcoming day of action here: https://t.co/PQ2627GQvX #Act4PD https://t.co/FKYlfX7GCG","1","indirect",NA
"1524453222437560320","us","NARAL Pro-Choice America","2022-05-11 18:15:45","17006036","NARAL","The Senate is voting on the Womens Health Protection Act TODAY! Let every senator know that you expect them to protect reproductive freedom. But if they come for our rights, were coming for their seats.  202-951-4571 @mintimm #WHPA #ActForAbortionAccess https://t.co/wW130cUMQR","The Senate is voting on the Womens Health Protection Act TODAY! Let every senator know that you expect them to protect reproductive freedom. But if they come for our rights, were coming for their seats.  202-951-4571 @mintimm #WHPA #ActForAbortionAccess https://t.co/wW130cUMQR","1","indirect",NA
"703691542784053250","us","Eris Group, LLC (fka Bartlett, Bendall, & Kadesh LLC)","2016-02-27 21:21:52","2318385202","GRLobby","Budget conference is in full swing! The HHS cmt hears a first offer from @MyFLHouse w/ @RepMHudson &amp; @SenReneGarcia https://t.co/k0BaSOvky5","Budget conference is in full swing! The HHS cmt hears a first offer from @MyFLHouse w/ @RepMHudson &amp; @SenReneGarcia https://t.co/k0BaSOvky5","1","direct",NA
"1385304813127278592","ire","AMEN Support Services LTD T/A Men[a]s Aid","2021-04-22 18:49:39","1139952528089595904","MensAidIreland","Please join us and stand with us tomorrow by wearing purple, dying your hair purple, baking purple...!
Show your support for all frontline services who help our family, friends and colleagues through domestic abuse &amp; coercive control. 
Wed love you to stand with us. #GoPurple  https://t.co/0FRzLrQ9Mt","Please join us and stand with us tomorrow by wearing purple, dying your hair purple, baking purple...!
Show your support for all frontline services who help our family, friends and colleagues through domestic abuse &amp; coercive control. 
Wed love you to stand with us. #GoPurple  https://t.co/0FRzLrQ9Mt","1","indirect",NA
"1337038167866822657","us","Grand Canyon University","2020-12-10 14:15:14","15853191","gcu","VOD James 2:26 https://t.co/aB1jcihA82","VOD James 2:26 https://t.co/aB1jcihA82","0",NA,"other"
"1463801371942166529","ire","Brown O[a]Connor Communications","2021-11-25 09:26:57","828382639744753665","Brown_OConnor","Featured in today[a]s @BelTel, @LWLLongford and @nirwnnews talk about the importance of the [a]From Grassroots to Government[a] programme, established by @CCBSCrossBorder. 
The programme is centred around increasing cross border engagement and amplifying the voices of women. https://t.co/c0eY2GLZSb","Featured in today[a]s @BelTel, @LWLLongford and @nirwnnews talk about the importance of the [a]From Grassroots to Government[a] programme, established by @CCBSCrossBorder. 
The programme is centred around increasing cross border engagement and amplifying the voices of women. https://t.co/c0eY2GLZSb","1","other",NA
"208603043359490048","us","Mary Bird Perkins Cancer Center","2012-06-01 16:56:56","119549040","MaryBirdPerkins","More! @anthonyryanauld #CancerSurvivors Celebration. http://t.co/6PdIBqvT","More! @anthonyryanauld #CancerSurvivors Celebration. http://t.co/6PdIBqvT","0",NA,"other"
"1513912841140641792","den","ICOMOS","2022-04-12 16:12:03","15018633","ICOMOS","Celebrate the #InternationalDayforMonumentsandSites on the theme [a]Heritage and Climate[a] with us on #18april, through a photographic submission, hosting an event or through a video submission if you are ICOMOS Committee or Working Group!

Get involved: https://t.co/URn2CU0FXb https://t.co/vLRbd2uuWn","Celebrate the #InternationalDayforMonumentsandSites on the theme [a]Heritage and Climate[a] with us on #18april, through a photographic submission, hosting an event or through a video submission if you are ICOMOS Committee or Working Group!

Get involved: https://t.co/URn2CU0FXb https://t.co/vLRbd2uuWn","1","indirect",NA
"1546937745003712512","us","REEF","2022-07-12 19:21:13","1138609452431446016","reeftechnology","Welcome to 2100 Hamilton St, a new addition to the #REEF Parking Network in Philadelphia. Thank you Dan Rufo, Director of Strategic Accounts, &amp; Steve Maiden, City Manager, for leading this effort. Join our network: https://t.co/yY7QeZYrcC #parkingsolutions #parkingmanagement https://t.co/i0iiBYjMa1","Welcome to 2100 Hamilton St, a new addition to the #REEF Parking Network in Philadelphia. Thank you Dan Rufo, Director of Strategic Accounts, &amp; Steve Maiden, City Manager, for leading this effort. Join our network: https://t.co/yY7QeZYrcC #parkingsolutions #parkingmanagement https://t.co/i0iiBYjMa1","0",NA,"organizational"
"716927101207724033","den","Soundvenue","2016-04-04 09:55:15","15648666","soundvenue","Vi har testet 8 ledningsfrie hrebffer  vinderen stter langt dyrere produkter til vgs https://t.co/YKgdsgmDoS https://t.co/rIeiysQ9Rn","We have tested 8 wireless hrebfers the winner states much more expensive products for vgs https://t.co/YKgdsgmDoS https://t.co/rIeiysQ9Rn","0",NA,"marketing"
"1550226592550486017","us","Los Angeles Community Services Center","2022-07-21 21:09:56","3389872390","LACo_DPSS","Congratulations to Dr. Laura Trejo, Director, and the newly established @CountyofLA Aging and Disabilities Department! At DPSS, we[a]re looking forward to partnering with them in service of #LACountys seniors and persons with disabilities. 

#seniors #disability @LACountyBOS https://t.co/T5KpP3bFdN","Congratulations to Dr. Laura Trejo, Director, and the newly established @CountyofLA Aging and Disabilities Department! At DPSS, we[a]re looking forward to partnering with them in service of #LACountys seniors and persons with disabilities. 

#seniors #disability @LACountyBOS https://t.co/T5KpP3bFdN","1","direct",NA
"1335116861034418177","ire","103.2 Dublin City FM","2020-12-05 07:00:39","21185644","dublincityfm","On the Green Room at 9am, Megan Best chats to Elaine Butler of Living Lightly in Ireland @LLinIreland. https://t.co/3c8tB7S5K7","On the Green Room at 9am, Megan Best chats to Elaine Butler of Living Lightly in Ireland @LLinIreland. https://t.co/3c8tB7S5K7","0",NA,"marketing"
"819186049498959872","us","Girl Scouts of Southern Illinois","2017-01-11 14:15:48","574779462","GSofSI","Its time for girls to rock their vote! Girls Choice badges are back -&gt;&gt; https://t.co/Ux3CQvzjJP #GirlsChoose https://t.co/tmxPluleN4","Its time for girls to rock their vote! Girls Choice badges are back -&gt;&gt; https://t.co/Ux3CQvzjJP #GirlsChoose https://t.co/tmxPluleN4","1","indirect",NA
"1197153557293735939","ire","Voice of Irish Concern for the Environment","2019-11-20 14:03:44","196149185","VOICE_Ireland","Look at these great waste prevention initiatives I saw when doing a #lunchandlearn at @AIBIreland. No single use coffee cups or containers and real glasses and water dispenser at reception. Well done! @CCCampaign_Irl #ditchthedisposables https://t.co/uVAXcxrkVU","Look at these great waste prevention initiatives I saw when doing a #lunchandlearn at @AIBIreland. No single use coffee cups or containers and real glasses and water dispenser at reception. Well done! @CCCampaign_Irl #ditchthedisposables https://t.co/uVAXcxrkVU","1","other",NA
"1393287556008140800","us","School Nutrition Association","2021-05-14 19:30:14","16045066","SchoolLunch","Take Action Now:Urge Your Member of Congress to support the Universal School Meals Program Act of 2021. #ChildNutrition #SchoolLunch https://t.co/GcOgWollrq","Take Action Now:Urge Your Member of Congress to support the Universal School Meals Program Act of 2021. #ChildNutrition #SchoolLunch https://t.co/GcOgWollrq","1","indirect",NA
"1306954529531928577","den","Telenor Group","2020-09-18 13:53:36","76588981","TelenorGroup","Nordic municipalities are getting smarter

According to the #NDMI2020, though, notable differences between municipalities exist in all Nordic countries. See what actions municipalities can take to increase their smart efforts in the report: https://t.co/Yhee9PwJ4Q. https://t.co/5RLyXHGHZq","Nordic municipalities are getting smarter

According to the #NDMI2020, though, notable differences between municipalities exist in all Nordic countries. See what actions municipalities can take to increase their smart efforts in the report: https://t.co/Yhee9PwJ4Q. https://t.co/5RLyXHGHZq","1","direct",NA
"793777991637663745","us","Arch Chemicals Contributions Program","2016-11-02 11:33:15","61157369","LonzaGroup","#Lonza is very proud to announce that our new #LonzaDrugProduct laboratories in Basel have officially been opened https://t.co/vUQL6qwGTs","#Lonza is very proud to announce that our new #LonzaDrugProduct laboratories in Basel have officially been opened https://t.co/vUQL6qwGTs","0",NA,"organizational"
"1524072062989520896","us","Leo A. Daly Company","2022-05-10 17:01:10","148874692","LeoADaly","We were thrilled Friday to learn that our #interiordesign for Omaha VA Ambulatory Care Center won Best in Show at the @IIDA_GP IDEA Awards Ceremony. This design firm did not shy away from a strong concept and metaphor, wrote one judge. Congratulations to the project team! https://t.co/eQtD10Lzos","We were thrilled Friday to learn that our #interiordesign for Omaha VA Ambulatory Care Center won Best in Show at the @IIDA_GP IDEA Awards Ceremony. This design firm did not shy away from a strong concept and metaphor, wrote one judge. Congratulations to the project team! https://t.co/eQtD10Lzos","0",NA,"organizational"
"997075579433308160","den","DJØF Offentlig","2018-05-17 11:25:17","2528180472","SaraVergo","Det er blevet vldig populrt at fejre det med en kage... Og nogle gange er det ogs helt p sin plads: Fx da vi p et #OK18 mde i Socialforvaltningen i Kbh Kommune gav kage til de superseje medlemmer af @djoef der opfandt [a]Pas p mig, jeg er ny i konflikt[a] sloganet  https://t.co/VaDxWXYPnX","It has become very popular to celebrate it with a cake... And sometimes it is ands completely p its place: Fx as we p a #OK18 mde in Social Administration in Kbh Municipality gave cake to the superseye members of @djoef who invented [a]Pas p me, I am new in conflict[a] slogan https://t.co/VaDxWXYPnX","1","direct",NA
"1471948541761363977","us","Association for Molecular Pathology","2021-12-17 21:00:54","74171204","AMPath","Open Comment Period: @AMPath &amp; @GeneticCouns released 8 draft recommendations to help address challenges in #NGS germline #variant confirmation. OCP closes 12/31/2021! https://t.co/ex1rWI6Ml8 https://t.co/R8umrOPdIl","Open Comment Period: @AMPath &amp; @GeneticCouns released 8 draft recommendations to help address challenges in #NGS germline #variant confirmation. OCP closes 12/31/2021! https://t.co/ex1rWI6Ml8 https://t.co/R8umrOPdIl","0",NA,"community"
"1164425226958098432","den","DI Digital","2019-08-22 06:33:02","875236008","di_digital_","Omstningen inden for esport forventes at fordobles fra 5,5 mia kr. i 2018 til 11,3 mia kr. i 2022 

Det skal vi udnytte i Danmark, og som branche, der higer efter dygtige it-specialister, skal vi glde os over esportens fremgang. 

https://t.co/RJI7fuAOvY

#dkpol #digdk #eSports https://t.co/9y6wXRN4dC","The export turnover is expected to double from $5.5 billion. in 2018 to $11.3 billion. in 2022 

We have to take advantage of this in Denmark, and as a industry looking for skilled IT specialists, we have to look forward to the progress of the esport. 

HTTPS://t.co/RJI7fuAOvY

#dkpol #digdk #eSports https://t.co/9y6wXRN4dC","1","other",NA
