"tweet_id","country","org_name","day","user_id","user_name","text","text_en","lobbying","lobbying_type","non_lobbying_type"
"1100390598111051776","den","Telenor Group","2019-02-26 13:42:17","76588981","TelenorGroup","In November 2018, @TelenorResearch[a]s Tech Trends predicted that AI Ethics would hit the agenda in a big way this year. 

Three months on, and @martinkenaite_i takes to the stage today at #MWC19 to broach that very topic. https://t.co/nZb4m2v3kq","In November 2018, @TelenorResearch[a]s Tech Trends predicted that AI Ethics would hit the agenda in a big way this year. 

Three months on, and @martinkenaite_i takes to the stage today at #MWC19 to broach that very topic. https://t.co/nZb4m2v3kq","1","other",NA
"855869519478358017","den","Erhvervsskolernes Elev-Organisation","2017-04-22 19:42:49","3243587787","glundholt","RT @eeodk: Den nyvalgte bestyrelse skal teambuilde og @glundholt og Steffen introducerer https://t.co/GI2SXq88Og","RT @eeodk: The newly elected board will introduce the team page and @glundholt and Steffen https://t.co/GI2SXq88Og","0",NA,"organizational"
"1278983196558925829","den","Bureau Veritas (BV) A/S","2020-07-03 09:25:31","166141989","bureauveritas","To have peace of mind on your choice of #vacation spot, visit Bureau Veritas dedicated platform! Already hundreds of places have been audited to guarantee you a safe trip. https://t.co/VkvILp5CuL #Shapingaworldoftrust #BtoBtoS #restartyourbusinesswithBV https://t.co/H4JTe03AmT","To have peace of mind on your choice of #vacation spot, visit Bureau Veritas dedicated platform! Already hundreds of places have been audited to guarantee you a safe trip. https://t.co/VkvILp5CuL #Shapingaworldoftrust #BtoBtoS #restartyourbusinesswithBV https://t.co/H4JTe03AmT","0",NA,"marketing"
"954471497871056896","us","Arkansas State Employees Association","2018-01-19 21:51:52","2862799421","AseaArk","Check out Magic Springs[a] newest discounts in their online store especially for ASEA members! CLICK HERE: https://t.co/gsL3nFseym https://t.co/sLUXbSbeht","Check out Magic Springs[a] newest discounts in their online store especially for ASEA members! CLICK HERE: https://t.co/gsL3nFseym https://t.co/sLUXbSbeht","0",NA,"marketing"
"1169622482103480323","den","ProData Consult A/S","2019-09-05 14:45:04","241089186","ProDataConsult","Currently seeking a Hadoop developer for a project in Warsaw, Poland. #ITJobs #freelance #banking #Hadoop #developer #apache #Scala #kafka #noSQL #MongoDB #Spark #Agile #Scrum #poland #consultants
 https://t.co/tjZ3pejIod https://t.co/aI5nbcozBy","Currently seeking a Hadoop developer for a project in Warsaw, Poland. #ITJobs #freelance #banking #Hadoop #developer #apache #Scala #kafka #noSQL #MongoDB #Spark #Agile #Scrum #poland #consultants
 https://t.co/tjZ3pejIod https://t.co/aI5nbcozBy","0",NA,"organizational"
"497742218116202496","den","Den Sociale Retshjælps Fond","2014-08-08 13:52:47","1857104412","DSRetshjaelp","5 fredage, 5 mrkesager! Nr1 indkomstregulerede sagsomkostninger, s ingen kommer ud til livslang gld. #dkpol #gld http://t.co/njgQDI6EUV","5 days, 5 days, 5 days! No. 1 income regulated case costs, s no one comes out for lifelong gld. #dkpol #gld http://t.co/njgQDI6EUV","1","other",NA
"1118541188989059074","den","European Energy A/S","2019-04-17 15:46:15","1012991514924978181","EuropeanEnergy_","Solar PV continues its rapid growth - a new report from IEA-PVPS shows that in 2018, China alone installed solar capacity equivalent to the installed global wind capacity. We expect minimum 25% annual global growth in the coming years. #wearegreenenergy #SolarPower https://t.co/XJ9rOi7sH3","Solar PV continues its rapid growth - a new report from IEA-PVPS shows that in 2018, China alone installed solar capacity equivalent to the installed global wind capacity. We expect minimum 25% annual global growth in the coming years. #wearegreenenergy #SolarPower https://t.co/XJ9rOi7sH3","1","direct",NA
"1316056719072653312","den","Junior Chamber International","2020-10-13 16:42:27","2995545105","jcicameroun","#ConventionNationale2020 : Jr-J - 3
Ils seront l et vs?

#ComblerLeFoss
#RetourAuxFondamentaux
#ConventionNationale2020
#JCICameroun
#JCIYaoundeExcel https://t.co/9u9ZMDHYpM","#ConventionNationale2020: Jr-J - 3
Will it be L and V?

by ComblerLeFoss
Return to Fundamental
The International Convention 2020
by JCICameroun
#JCIYaoundeExcel https://t.co/9u9ZMDHYpM","0",NA,"other"
"1341065242843951104","us","James A. Baker III Institute for Public Policy","2020-12-21 16:57:24","59218882","BakerInstitute","Season[a]s Greetings and Best Wishes for 2021 from the Director, Fellows, Scholars and Staff of Rice University[a]s Baker Institute for Public Policy https://t.co/ZwkbEcGKOT","Season[a]s Greetings and Best Wishes for 2021 from the Director, Fellows, Scholars and Staff of Rice University[a]s Baker Institute for Public Policy https://t.co/ZwkbEcGKOT","0",NA,"community"
"672078067637092352","den","Netflix Danmark A/S","2015-12-02 15:41:12","757261795","Netflix_DK","When you tell your housemate they need to get with the program and watch #Narcos https://t.co/l0jjNphaQ1","When you tell your housemate they need to get with the program and watch #Narcos https://t.co/l0jjNphaQ1","0",NA,"marketing"
"1384508958455603200","den","Egmont Intstitute","2021-04-20 14:07:13","1670601139","EgmontInstitute","RT @AtlForum:  we are LIVE now Watch is here  https://t.co/uzvjS4Oiqh https://t.co/aQmOSn2bSH","RT @AtlForum:  we are LIVE now Watch is here  https://t.co/uzvjS4Oiqh https://t.co/aQmOSn2bSH","0",NA,"organizational"
"1485975804102148096","ire","Accenture PLC","2022-01-25 14:00:14","10194682","Accenture","Discover how Mehmet is doing incredible things in Accenture Interactive to help his clients get the full value of cloud. Want to work like Mehmet? https://t.co/RLMQNGacQx https://t.co/PdGslaTEi4","Discover how Mehmet is doing incredible things in Accenture Interactive to help his clients get the full value of cloud. Want to work like Mehmet? https://t.co/RLMQNGacQx https://t.co/PdGslaTEi4","0",NA,"marketing"
"1314240135056158720","den","OCEANA","2020-10-08 16:24:00","29221344","oceana","Family always has your #back.  https://t.co/CF9CnC1e0I","Family always has your #back.  https://t.co/CF9CnC1e0I","0",NA,"community"
"1360967208239845384","us","Texas Elementary Principals and Supervisors Association","2021-02-14 15:00:42","36105384","TEPSAtalk","Meet the candidates for TEPSA State Office and preview your regions proposed Bylaws. On February 23, eligible TEPSA voting members will receive a link to the ballot. The election runs February 23  March 9.

Learn more: https://t.co/IUkl0pG6b2

#WeLeadTX #TXed https://t.co/yY8HzGmHlv","Meet the candidates for TEPSA State Office and preview your regions proposed Bylaws. On February 23, eligible TEPSA voting members will receive a link to the ballot. The election runs February 23  March 9.

Learn more: https://t.co/IUkl0pG6b2

#WeLeadTX #TXed https://t.co/yY8HzGmHlv","1","indirect",NA
"388601451678666752","den","Hands Off Venezuela","2013-10-11 09:46:20","1070720263","HOVcampaign","LONDON October 12, rally and workshops - Free Our America - No to Free Trade  Agreements https://t.co/NmV8TBHWMU http://t.co/t3s5X1k8sL","LONDON October 12, rally and workshops - Free Our America - No to Free Trade  Agreements https://t.co/NmV8TBHWMU http://t.co/t3s5X1k8sL","1","other",NA
"1489189913509699591","den","Dansk Kvindesamfund","2022-02-03 10:51:57","988406744","Kvindesamfund","RT @UN_Women: Include women. https://t.co/8jqaeewuiy","RT @UN_Women: Include women. https://t.co/8jqaeewuiy","1","direct",NA
"1438502258811891715","us","Hispanic Association of Colleges and Universities","2021-09-16 13:57:19","189261917","HACUNews","Day 4 of National HSIs Week Fact! Celebrate the important role your institution and other #HSIs play in improving access to education and advancing equity for historically underserved students. Tag @HACUNews and use hashtag #HSIsWeek. https://t.co/yIkqkyDjXm","Day 4 of National HSIs Week Fact! Celebrate the important role your institution and other #HSIs play in improving access to education and advancing equity for historically underserved students. Tag @HACUNews and use hashtag #HSIsWeek. https://t.co/yIkqkyDjXm","1","indirect",NA
"1331003090523222016","den","OCEANA","2020-11-23 22:34:00","29221344","oceana","Sharks need our help. Fins from up to 73 million sharks end up in the global fin trade each year. Tell your U.S. senators to protect sharks and pass a nationwide fin ban today: https://t.co/rwS3JNIi3a #FinBanNow https://t.co/biwjn6cMlt","Sharks need our help. Fins from up to 73 million sharks end up in the global fin trade each year. Tell your U.S. senators to protect sharks and pass a nationwide fin ban today: https://t.co/rwS3JNIi3a #FinBanNow https://t.co/biwjn6cMlt","1","indirect",NA
"578957532812705792","den","Veron WHISTLEBLOWERORGANISATIONEN I DANMARK","2015-03-20 16:33:26","2883203182","verondk","RT @FrejaWedenborg: #SDUcrypto er i gang! @kjaerulv @peterkofod @kramse @kajotweets @prosastud @verondk http://t.co/kh7x7pzgeY","RT @FrejaWedenborg: #SDUcrypto is I gang! @kjaerulv @peterkofod @kramse @kajotweets @prosastud @verondk http://t.co/kh7x7pzgeY","0",NA,"marketing"
"1297149017399398400","den","OCEANA","2020-08-22 12:30:00","29221344","oceana","Show some love for these adorable polar bears! Polar bears and other Arctic marine life rely on clean oceans for survival. Use your voice today to keep the Arctic safe and free from offshore drilling: https://t.co/yLQt3V4OOW  #ProtectOurCoast https://t.co/59hTKov8HD","Show some love for these adorable polar bears! Polar bears and other Arctic marine life rely on clean oceans for survival. Use your voice today to keep the Arctic safe and free from offshore drilling: https://t.co/yLQt3V4OOW  #ProtectOurCoast https://t.co/59hTKov8HD","1","indirect",NA
"1490782686243401732","den","Parkinsonforeningen","2022-02-07 20:21:04","107546283","ParkinsonDotOrg","Moving Day is a movement for change  towards more awareness, more funding and more understanding of Parkinsons disease. It is your chance to speak up about PD and move others to take action!

Learn more about Moving Day at https://t.co/s8EVgdU1Vn https://t.co/nBJXTkTUJp","Moving Day is a movement for change  towards more awareness, more funding and more understanding of Parkinsons disease. It is your chance to speak up about PD and move others to take action!

Learn more about Moving Day at https://t.co/s8EVgdU1Vn https://t.co/nBJXTkTUJp","1","indirect",NA
"1489707683418619905","den","Danish Society for Prevention of Child Abuse and Neglect (DASPCAN)","2022-02-04 21:09:23","1093478892","ISPCAN","TUESDAY! Documentation of Violence &amp; Torture - https://t.co/ClHIN9aRry https://t.co/Mu43islUfI","TUESDAY! Documentation of Violence &amp; Torture - https://t.co/ClHIN9aRry https://t.co/Mu43islUfI","1","other",NA
"1552747014026313729","den","World Food Programme (WFP)","2022-07-28 20:05:11","27830610","WFP","Ayan[a]s family traveled a month to reach Dolow. 

Her husband died after arrival and at 6 months pregnant, Ayan too is receiving specialized nutrition support from WFP.

Four years of drought in #Somalia has left around 7 million people facing crisis level food insecurity.

2/2 https://t.co/UAeCP19BRu","Ayan[a]s family traveled a month to reach Dolow. 

Her husband died after arrival and at 6 months pregnant, Ayan too is receiving specialized nutrition support from WFP.

Four years of drought in #Somalia has left around 7 million people facing crisis level food insecurity.

2/2 https://t.co/UAeCP19BRu","1","other",NA
"1555471178168508416","us","Forbes, Inc.","2022-08-05 08:30:02","91478624","Forbes","After just two seasons in their new home the Las Vegas Raiders have seen their value skyrocketat least based on the valuation of the team in a pending minority stake sale. https://t.co/pmINTadwVk https://t.co/LCfZFBPDNl","After just two seasons in their new home the Las Vegas Raiders have seen their value skyrocketat least based on the valuation of the team in a pending minority stake sale. https://t.co/pmINTadwVk https://t.co/LCfZFBPDNl","0",NA,"organizational"
"1245354260616929281","us","Oklahoma Farm Bureau","2020-04-01 14:16:07","1026800533","okfarmbureau","Happy #CensusDay! If youve already completed your #2020Census, retweet to let all your friends &amp; family know you helped make sure #RuralOklahomaCounts! Learn more at https://t.co/U9kZrY1a4W or https://t.co/mxVvunftvI. https://t.co/w5aqzF3k81","Happy #CensusDay! If youve already completed your #2020Census, retweet to let all your friends &amp; family know you helped make sure #RuralOklahomaCounts! Learn more at https://t.co/U9kZrY1a4W or https://t.co/mxVvunftvI. https://t.co/w5aqzF3k81","1","indirect",NA
"943072812570423296","den","Greater Copenhagen and Skåne Committee","2017-12-19 10:57:34","3065989114","GreaterCph","Deltagarna var eniga efter avstmning, infrastruktur och mobilitet r viktigast fr en gemensam arbetsmarknad. Nu politisk paneldebatt med  @nielshorup, @peterdanielsson, @SophieHAndersen och @KatrinS_J om vad #GreaterCph kan gra. #GreaterCph toppmte 2017. https://t.co/2F4ETMEsto","The participants were unanimous in the context of decrease, infrastructure and mobility, which is most important for a common labour market. Now political panel discussion with @nielshorup, @peterdanielsson, @SophieHAndersen and @KatrinS_J about what #GreaterCph can play. #GreaterCph top 2017 https://t.co/2F4ETMEsto","1","direct",NA
"1503756128534081542","den","Mellemfolkeligt Samvirke","2022-03-15 15:32:54","60839474","ActionAidDK","FAIR flygtningepolitik for ALLE Kom med til demonstration! FB-event her: https://t.co/55xwyYTWFA @dfunk_dk @amnestydk #dkpol #fairlov #refugeeswelcome https://t.co/yYglWxUTSE","Fair Refugee Policy for All Come to the Demonstration! FB event here: https://t.co/55xwyYTWFA @dfunk_dk @amnestydk #dkpol #fairlov #refugeeswelcome https://t.co/yYglWxUTSE","1","indirect",NA
"1299015606445002754","us","Greater Raleigh Chamber of Commerce","2020-08-27 16:07:09","18083720","raleighchamber","How can companies create space inside their organizations to acknowledge important societal issues, including the recent protests, and the systemic racism that gave rise to them? Learn more at Courageous Conversation on Sept. 9. #CourageousConversation https://t.co/mKscb5WLR9 https://t.co/kFz8JwioX2","How can companies create space inside their organizations to acknowledge important societal issues, including the recent protests, and the systemic racism that gave rise to them? Learn more at Courageous Conversation on Sept. 9. #CourageousConversation https://t.co/mKscb5WLR9 https://t.co/kFz8JwioX2","1","indirect",NA
"1090318541054771200","den","Anima Danmark","2019-01-29 18:39:31","108278794","animadk","RID ALDRIG P ELEFANTER 

Skriv under her: https://t.co/LwBlMDXvL9 

Credit: Moving Animals https://t.co/ythXku5xtg","RID ALDRIG P ELEFANTER 

Skriv under her: https://t.co/LwBlMDXvL9 

Credit: Moving Animals https://t.co/ythXku5xtg","1","indirect",NA
"1465678771135078408","ire","Smashing Times Theatre and Film Company","2021-11-30 13:47:04","342653473","Smashing_Times"," Calling all young writers!  
Our friends at @FightingWordsIE are seeking submissions of new writing for their @IrishTimes supplement from secondary school students!
All details here: https://t.co/lAjpyvf1Vl https://t.co/yEwuTJhgoA"," Calling all young writers!  
Our friends at @FightingWordsIE are seeking submissions of new writing for their @IrishTimes supplement from secondary school students!
All details here: https://t.co/lAjpyvf1Vl https://t.co/yEwuTJhgoA","0",NA,"community"
"1471822358067490823","den","LEGO A/S","2021-12-17 12:39:29","295325513","LEGO_Group","https://t.co/gtIIHy6Cqc","https://t.co/gtIIHy6Cqc","0",NA,"other"
"1453043752960991238","den","American Express S.A.","2021-10-26 17:00:01","42712551","AmericanExpress","#WithAmex, Card Members have early access to @billyjoel s shows in Las Vegas, NV and Hollywood, FL now thru 10/28. Dont miss the chance to see him live! #AmexPresale Supply is limited. Terms Apply. https://t.co/Paqy2TSpbZ https://t.co/qwzKHBKl9i","#WithAmex, Card Members have early access to @billyjoel s shows in Las Vegas, NV and Hollywood, FL now thru 10/28. Dont miss the chance to see him live! #AmexPresale Supply is limited. Terms Apply. https://t.co/Paqy2TSpbZ https://t.co/qwzKHBKl9i","0",NA,"marketing"
"1485190896773742592","ire","Bray Wanderers FC","2022-01-23 10:01:17","23442900","BrayWanderers","The club are delighted to announce the signing of Michael Kelly. Since debuting in the League of Ireland back in 2014, the 25-year goalkeeper has experienced spells with Shamrock Rovers, @Cabinteely_FC (twice), Bohemians and Longford Town (twice) as well as a stint with QPR. https://t.co/fezvTKtG7y","The club are delighted to announce the signing of Michael Kelly. Since debuting in the League of Ireland back in 2014, the 25-year goalkeeper has experienced spells with Shamrock Rovers, @Cabinteely_FC (twice), Bohemians and Longford Town (twice) as well as a stint with QPR. https://t.co/fezvTKtG7y","0",NA,"organizational"
"1068121595741421568","ire","Britvic Ireland","2018-11-29 12:36:47","227349294","Britvic","Were proud to announce another strong performance driven by the continued execution of our strategy and our supply chain investment over the past year #BritvicResults2018 https://t.co/8dk0B8AGE1 https://t.co/aQJhTQW2v7","Were proud to announce another strong performance driven by the continued execution of our strategy and our supply chain investment over the past year #BritvicResults2018 https://t.co/8dk0B8AGE1 https://t.co/aQJhTQW2v7","0",NA,"organizational"
"1165987358656913411","us","Southwest Research Institute","2019-08-26 14:00:23","25301238","SwRI","The National Safety Council has selected SwRIs Matthew Herron to receive a 2019 Rising Stars of Safety Award for demonstrating leadership and engaging peers around a culture of safety. Congratulations, Matthew! #NSCRisingStars @NSCsafety
https://t.co/wAAPG6bYuK https://t.co/gAaUcSN7hB","The National Safety Council has selected SwRIs Matthew Herron to receive a 2019 Rising Stars of Safety Award for demonstrating leadership and engaging peers around a culture of safety. Congratulations, Matthew! #NSCRisingStars @NSCsafety
https://t.co/wAAPG6bYuK https://t.co/gAaUcSN7hB","0",NA,"organizational"
"1531638946001833984","den","Globalt Fokus","2022-05-31 14:09:15","2775839877","globaltfokus","Italien har en. Norge har en. Madagascar har en. Faktisk har ca.150 lande grnne forfatninger, og det gr en forskel. Der er pvist 15% forbedring af miljet i lande med grnne forfatninger. Derfor br DK ogs f en!
Kom med til konference om #GrnGrundlov
https://t.co/tDL3tFQ656 https://t.co/5buCRRixMt","Italy has one. Norway has one. Madagascar has one. In fact, approximately 150 countries have crushed constitutions, and that makes a difference. There has been a 15% improvement in the militia in countries with fragile constitutions. That’s why I’m going to be one!
Join the conference on #GrnGrundlov
https://t.co/tDL3tFQ656 https://t.co/5buCRRixMt","1","other",NA
"1310122656478437377","den","DI Dansk Industri","2020-09-27 07:42:36","2496330217","DanskIndustri","Vi skal investere i forskning, uddannelse og innovation. I krisetider har vi brug for nye ider, der kan skabe nye muligheder og en bedre fremtid. Se DI Topmdet LIVE tirsdag den 29. kl. 13.00 https://t.co/XPG8BohQQf #dkpol #forskpol #uddpol https://t.co/Q1MQDUvQbe","We must invest in research, education and innovation. In times of crisis, we need new ideas that can create new opportunities and a better future. Look at it on Tuesday, at 29 p.m. 13.00 https://t.co/XPG8BohQQf #dkpol #forskpol #uddpol https://t.co/Q1MQDUvQbe","1","other",NA
"576274394835787776","den","Arla Foods","2015-03-13 06:51:37","35806386","ArlaDanmark","RT @T_Pietrangeli: Svrt at f armene ned... 3 ud af 3 innovationspriser...tak til alle i Arla Danmark! http://t.co/x6FQf9lBhH","RT @T_Pietrangeli: Write that your arms down... 3 out of 3 innovation awards...thank to everyone in Arla Denmark! HTTP://t.co/x6FQf9lBhH","0",NA,"organizational"
"1533896284335132673","den","Vattenfall A/S","2022-06-06 19:39:07","1059412656526897152","Vattenfall_DK","@rasmushelveg mrkede i dag historiens vingesus under en 188 m. hj mlle p Kriegers Flak. Rasmus har vret med fra den spde start i 2012 og kunne i dag se resultatet sammen med MF @KathrineOlldag og Michael Larsen fra Vordingborg https://t.co/AbkzuiygEz.   #dkenergi https://t.co/2x31YT4CYX","@rasmushelveg mrked today the history's vingesus under a 188 m. h. mlle p Kriegers Flak. Rasmus has come with from the top start in 2012 and could today see the result together with MF @KathrineOlldag and Michael Larsen from Vordingborg https://t.co/AbkzuiygEz.   #dkenergi https://t.co/2x31YT4CYX","1","direct",NA
"1346096731931471879","ire","Institute of International and European Affairs","2021-01-04 14:10:44","38675236","iiea","The @EMA_News is expected to makes its final decision on approving the Moderna vaccine later today and on Friday, 15 January Emer Cooke, the Irish woman leading the European Medicines Agency, joins us to discuss #COVID19 and the EMA[a]s role.

Sign up here: https://t.co/I2NTVM7zNv https://t.co/tXVdmtkUNE","The @EMA_News is expected to makes its final decision on approving the Moderna vaccine later today and on Friday, 15 January Emer Cooke, the Irish woman leading the European Medicines Agency, joins us to discuss #COVID19 and the EMA[a]s role.

Sign up here: https://t.co/I2NTVM7zNv https://t.co/tXVdmtkUNE","1","direct",NA
"956439906821304320","den","NNIT A/S","2018-01-25 08:13:38","23908185","nnit","Full house to our #S4HANA seminar today with focus on resolving challenges in #finance and #logistics https://t.co/AbyPQ1V1Ll","Full house to our #S4HANA seminar today with focus on resolving challenges in #finance and #logistics https://t.co/AbyPQ1V1Ll","0",NA,"community"
"355487352807907329","ire","Rio Tinto plc","2013-07-12 00:42:44","14472978","RioTinto","Kestrel Mine Extension starts production http://t.co/kTz6DwWLOn http://t.co/19CcyUP7gs","Kestrel Mine Extension starts production http://t.co/kTz6DwWLOn http://t.co/19CcyUP7gs","0",NA,"organizational"
"1144340143928561664","den","Computerworld ApS","2019-06-27 20:22:05","24575417","Computerworlddk","Det strkt forsinkede kommunale kmpesystem, KY, p vej i pilottest: Tre kommuner skal prvekre https://t.co/FLk3h6MBdf https://t.co/YUnVG0183Y","The strictly delayed municipal kmpesystem, KY, p way in pilot test: Three municipalities must prvekre https://t.co/FLk3h6MBdf https://t.co/YUnVG0183Y","0",NA,"other"
"1475436529170493449","ire","Irish Association for Counselling and Psychotherapy - IACP","2021-12-27 12:00:55","3761495548","IACP_ie","Christmas is a time where traditionally we think of others. What small acts of kindness can we do to lift others? What small act of kindness can we bestow to ourselves? #Christmas #Kindess https://t.co/rBUcKoRnv9","Christmas is a time where traditionally we think of others. What small acts of kindness can we do to lift others? What small act of kindness can we bestow to ourselves? #Christmas #Kindess https://t.co/rBUcKoRnv9","0",NA,"community"
"1499294422151962624","den","LEGO A/S","2022-03-03 08:03:40","295325513","LEGO_Group","This International Womens Day were celebrating the powerful contribution made by women in design. But did you know theres a real lack of women working in this space around the world? #IWD https://t.co/bVkMd73Sbn","This International Womens Day were celebrating the powerful contribution made by women in design. But did you know theres a real lack of women working in this space around the world? #IWD https://t.co/bVkMd73Sbn","1","other",NA
"410811426324758528","us","Plumbing Manufacturers International","2013-12-11 16:40:51","424775052","PlumbingMfgIntl","RT @SafePlumbing: PMI staff welcomes its newest member Jodi Stuhrberg, Association Coordinator, to its team. http://t.co/mcC5fM8GyA","RT @SafePlumbing: PMI staff welcomes its newest member Jodi Stuhrberg, Association Coordinator, to its team. http://t.co/mcC5fM8GyA","0",NA,"organizational"
"1522555012483891204","den","Northcom A/S","2022-05-06 12:32:57","4274729481","northcomdk","Md vores nye kollega, Kenneth Vinther  Kenneth er blevet en del af vores salgsteam og har stor erfaring med bl.a. @Peplink routere samt DAS/indendrsdkning. Kenneth vil vre at finde p vores kontor i Ishj samt ude p de danske landeveje. 
#Northcom #Peplink #DAS https://t.co/gqy0yJrOCl","With our new colleague, Kenneth Vinther Kenneth has become part of our sales team and has great experience with among others. @Peplink router as well as DAS/internship. Kenneth will be angry to find our office in Ishj as well as out on the Danish roads. 
#Northcom #Peplink #DAS https://t.co/gqy0yJrOCl","0",NA,"organizational"
"1027946452369195008","den","Flensborg Avis A.G.","2018-08-10 15:55:07","705055709495488512","Flensborg_Avis","Bugt p Saturns mne Titan fik navn efter Flensborg Fjord. Ls mere her: https://t.co/3u665xqmG8 #space #Saturn #dkvid #nasa #esa https://t.co/HqtqX8Kt2f","Saturn's myth Titan was named after Flensborg Fjord. Read more here: https://t.co/3u665xqmG8 #space #Saturn #dkwhite #nasa #esa https://t.co/HqtqX8Kt2f","0",NA,"other"
"1506936904540995586","den","Danske Regioner","2022-03-24 10:12:10","601813544","regionerne","Stende klapsalver til afgende formand for Danske Regioner, Stephanie Lose, til Danske Regioners generalforsamling 2022. #regioner22 #sundpol #dkpol https://t.co/o0fUj9LxaZ","Stende klapsalver to the Deputy Chairman of the Danish Regions, Stephanie Lose, to the General Assembly of the Danish Regions 2022. #regioner22 #sundpol #dkpol https://t.co/o0fUj9LxaZ","0",NA,"community"
